{
  "id": "shrimp",
  "version": 1,
  "content_status": "draft_llm_generated",
  "role": "protein_source",
  "name": "Shrimp",
  "macros_per_100g": {
    "calories": 99,
    "protein_g": 24,
    "carbs_g": 0.2,
    "fat_g": 0.3
  },
  "contains": [
    "shellfish"
  ],
  "digestion_flags": [],
  "unit_hint": {
    "label": "oz",
    "grams": 28
  },
  "min_grams": 80,
  "max_grams": 200,
  "author": null,
  "created_at": "2026-07-13"
}
