{
  "id": "greek_yogurt",
  "version": 1,
  "content_status": "draft_llm_generated",
  "role": "protein_source",
  "name": "Greek yogurt",
  "macros_per_100g": {
    "calories": 59,
    "protein_g": 10,
    "carbs_g": 3.6,
    "fat_g": 0.4
  },
  "contains": [
    "dairy"
  ],
  "digestion_flags": [],
  "unit_hint": {
    "label": "cup",
    "grams": 245
  },
  "min_grams": 100,
  "max_grams": 300,
  "author": null,
  "created_at": "2026-07-13"
}
