{
  "id": "coconut_milk",
  "version": 1,
  "content_status": "draft_llm_generated",
  "role": "fat_source",
  "name": "Coconut milk",
  "macros_per_100g": {
    "calories": 230,
    "protein_g": 2.3,
    "carbs_g": 6,
    "fat_g": 24
  },
  "contains": [],
  "digestion_flags": [
    "reflux"
  ],
  "unit_hint": {
    "label": "1/4 cup",
    "grams": 60
  },
  "min_grams": 30,
  "max_grams": 150,
  "author": null,
  "created_at": "2026-07-13"
}
