{
  "id": "quinoa_cooked",
  "version": 1,
  "content_status": "draft_llm_generated",
  "role": "carb_source",
  "name": "Quinoa, cooked",
  "macros_per_100g": {
    "calories": 120,
    "protein_g": 4.4,
    "carbs_g": 21,
    "fat_g": 1.9
  },
  "contains": [],
  "digestion_flags": [],
  "unit_hint": {
    "label": "cooked cup",
    "grams": 185
  },
  "min_grams": 50,
  "max_grams": 300,
  "author": null,
  "created_at": "2026-07-13"
}
