{
  "id": "almond_butter",
  "version": 1,
  "content_status": "draft_llm_generated",
  "role": "fat_source",
  "name": "Almond butter",
  "macros_per_100g": {
    "calories": 614,
    "protein_g": 21,
    "carbs_g": 19,
    "fat_g": 56
  },
  "contains": [
    "nuts"
  ],
  "digestion_flags": [],
  "unit_hint": {
    "label": "tbsp",
    "grams": 16
  },
  "min_grams": 8,
  "max_grams": 40,
  "author": null,
  "created_at": "2026-07-13"
}
