{
  "id": "tempeh",
  "version": 1,
  "content_status": "draft_llm_generated",
  "role": "protein_source",
  "name": "Tempeh",
  "macros_per_100g": {
    "calories": 195,
    "protein_g": 20,
    "carbs_g": 7.6,
    "fat_g": 11
  },
  "contains": [],
  "digestion_flags": [],
  "unit_hint": {
    "label": "oz",
    "grams": 28
  },
  "min_grams": 60,
  "max_grams": 250,
  "author": null,
  "created_at": "2026-07-13"
}
