{
  "id": "brown_rice_cooked",
  "version": 1,
  "content_status": "draft_llm_generated",
  "role": "carb_source",
  "name": "Brown rice, cooked",
  "macros_per_100g": {
    "calories": 123,
    "protein_g": 2.7,
    "carbs_g": 26,
    "fat_g": 1
  },
  "contains": [],
  "digestion_flags": [],
  "unit_hint": {
    "label": "cooked cup",
    "grams": 195
  },
  "min_grams": 50,
  "max_grams": 300,
  "author": null,
  "created_at": "2026-07-13"
}
