{
  "id": "chia_seeds",
  "version": 1,
  "content_status": "draft_llm_generated",
  "role": "fat_source",
  "name": "Chia seeds",
  "macros_per_100g": {
    "calories": 486,
    "protein_g": 17,
    "carbs_g": 42,
    "fat_g": 31
  },
  "contains": [],
  "digestion_flags": [],
  "unit_hint": {
    "label": "tbsp",
    "grams": 12
  },
  "min_grams": 8,
  "max_grams": 40,
  "author": null,
  "created_at": "2026-07-13"
}
