{
  "id": "lentils_cooked",
  "version": 1,
  "content_status": "draft_llm_generated",
  "role": "protein_source",
  "name": "Cooked lentils",
  "macros_per_100g": {
    "calories": 116,
    "protein_g": 9,
    "carbs_g": 20,
    "fat_g": 0.4
  },
  "contains": [],
  "digestion_flags": [
    "bloating",
    "ibs_like_sensitivity"
  ],
  "unit_hint": {
    "label": "cup",
    "grams": 198
  },
  "min_grams": 100,
  "max_grams": 300,
  "author": null,
  "created_at": "2026-07-13"
}
