{
  "id": "avocado",
  "version": 1,
  "content_status": "draft_llm_generated",
  "role": "fat_source",
  "name": "Avocado",
  "macros_per_100g": {
    "calories": 160,
    "protein_g": 2,
    "carbs_g": 8.5,
    "fat_g": 14.7
  },
  "contains": [],
  "digestion_flags": [],
  "unit_hint": {
    "label": "half avocado",
    "grams": 100
  },
  "min_grams": 30,
  "max_grams": 150,
  "author": null,
  "created_at": "2026-07-13"
}
