{
  "id": "mixed_nuts",
  "version": 1,
  "content_status": "draft_llm_generated",
  "role": "fat_source",
  "name": "Mixed nuts",
  "macros_per_100g": {
    "calories": 607,
    "protein_g": 20,
    "carbs_g": 21,
    "fat_g": 54
  },
  "contains": [
    "nuts"
  ],
  "digestion_flags": [],
  "unit_hint": {
    "label": "tbsp",
    "grams": 9
  },
  "min_grams": 10,
  "max_grams": 40,
  "author": null,
  "created_at": "2026-07-13"
}
