{
  "id": "olive_oil",
  "version": 1,
  "content_status": "draft_llm_generated",
  "role": "fat_source",
  "name": "Olive oil",
  "macros_per_100g": {
    "calories": 884,
    "protein_g": 0,
    "carbs_g": 0,
    "fat_g": 100
  },
  "contains": [],
  "digestion_flags": [],
  "unit_hint": {
    "label": "tbsp",
    "grams": 14
  },
  "min_grams": 5,
  "max_grams": 25,
  "author": null,
  "created_at": "2026-07-13"
}
