{
  "id": "ghee",
  "version": 1,
  "content_status": "draft_llm_generated",
  "role": "fat_source",
  "name": "Ghee",
  "macros_per_100g": {
    "calories": 876,
    "protein_g": 0.3,
    "carbs_g": 0,
    "fat_g": 99.5
  },
  "contains": [
    "dairy"
  ],
  "digestion_flags": [],
  "unit_hint": {
    "label": "tbsp",
    "grams": 13
  },
  "min_grams": 5,
  "max_grams": 25,
  "author": null,
  "created_at": "2026-07-13"
}
