{
  "id": "corn_tortilla",
  "version": 1,
  "content_status": "draft_llm_generated",
  "role": "carb_source",
  "name": "Corn tortilla",
  "macros_per_100g": {
    "calories": 218,
    "protein_g": 5.7,
    "carbs_g": 44,
    "fat_g": 2.8
  },
  "contains": [],
  "digestion_flags": [],
  "unit_hint": {
    "label": "tortilla",
    "grams": 26
  },
  "min_grams": 30,
  "max_grams": 150,
  "author": null,
  "created_at": "2026-07-13"
}
