{
  "id": "turkey_breast",
  "version": 1,
  "content_status": "draft_llm_generated",
  "role": "protein_source",
  "name": "Turkey breast",
  "macros_per_100g": {
    "calories": 135,
    "protein_g": 30,
    "carbs_g": 0,
    "fat_g": 1
  },
  "contains": [
    "meat"
  ],
  "digestion_flags": [],
  "unit_hint": {
    "label": "raw turkey breast",
    "grams": 150
  },
  "min_grams": 60,
  "max_grams": 220,
  "author": null,
  "created_at": "2026-07-13"
}
