{
  "id": "edamame_shelled",
  "version": 1,
  "content_status": "draft_llm_generated",
  "role": "protein_source",
  "name": "Edamame, shelled",
  "macros_per_100g": {
    "calories": 122,
    "protein_g": 11,
    "carbs_g": 10,
    "fat_g": 5
  },
  "contains": [],
  "digestion_flags": [],
  "unit_hint": {
    "label": "cup",
    "grams": 155
  },
  "min_grams": 80,
  "max_grams": 250,
  "author": null,
  "created_at": "2026-07-13"
}
