{
  "id": "cheese_cheddar",
  "version": 1,
  "content_status": "draft_llm_generated",
  "role": "fat_source",
  "name": "Cheddar cheese",
  "macros_per_100g": {
    "calories": 403,
    "protein_g": 25,
    "carbs_g": 1.3,
    "fat_g": 33
  },
  "contains": [
    "dairy"
  ],
  "digestion_flags": [
    "sensitive_stomach"
  ],
  "unit_hint": {
    "label": "slice",
    "grams": 28
  },
  "min_grams": 10,
  "max_grams": 60,
  "author": null,
  "created_at": "2026-07-13"
}
