{
  "id": "butter",
  "version": 1,
  "content_status": "draft_llm_generated",
  "role": "fat_source",
  "name": "Butter",
  "macros_per_100g": {
    "calories": 717,
    "protein_g": 0.9,
    "carbs_g": 0.1,
    "fat_g": 81
  },
  "contains": [
    "dairy"
  ],
  "digestion_flags": [
    "reflux"
  ],
  "unit_hint": {
    "label": "tbsp",
    "grams": 14
  },
  "min_grams": 5,
  "max_grams": 25,
  "author": null,
  "created_at": "2026-07-13"
}
