{
  "id": "cod",
  "version": 1,
  "content_status": "draft_llm_generated",
  "role": "protein_source",
  "name": "Cod fillet",
  "macros_per_100g": {
    "calories": 82,
    "protein_g": 18,
    "carbs_g": 0,
    "fat_g": 0.7
  },
  "contains": [
    "fish"
  ],
  "digestion_flags": [],
  "unit_hint": {
    "label": "fillet",
    "grams": 160
  },
  "min_grams": 80,
  "max_grams": 220,
  "author": null,
  "created_at": "2026-07-13"
}
